{
  "schema_version": "1",
  "product": {
    "name": "tailtrail",
    "version": "0.6.0",
    "version_sources": [
      "pyproject.toml",
      ".codex-plugin/plugin.json",
      "tailtrail/__init__.py"
    ]
  },
  "candidate_additions": [
    "COMPLETE-END-TO-END-WORKFLOW.md",
    "ENTERPRISE-READINESS-ASSESSMENT.md",
    "MANIFEST.in",
    "PACKAGE-CONTRACT.md",
    "INSTALLER-LIFECYCLE.md",
    "HOST-ADAPTERS.md",
    "SUPPLY-CHAIN.md",
    "REPOSITORY-ENFORCEMENT.md",
    "TAILTRAIL-STOP-RESUME-CONTROL-IMPLEMENTATION-PLAN.md",
    "NAVIGATOR-FALSE-STOP-REMEDIATION-PLAN.md",
    "aidlc-docs/phase-e0-design.md",
    "aidlc-docs/phase-e0-requirements.md",
    "aidlc-docs/phase-e1-design.md",
    "aidlc-docs/phase-e1-requirements.md",
    "aidlc-docs/phase-e2-design.md",
    "aidlc-docs/phase-e2-requirements.md",
    "aidlc-docs/phase-e3-design.md",
    "aidlc-docs/phase-e3-requirements.md",
    "aidlc-docs/phase-e4-design.md",
    "aidlc-docs/phase-e4-requirements.md",
    "aidlc-docs/phase-e5-dependency-decision.md",
    "aidlc-docs/phase-e5-design.md",
    "aidlc-docs/phase-e5-requirements.md",
    "aidlc-docs/phase-e6-design.md",
    "aidlc-docs/phase-e6-requirements.md",
    "aidlc-docs/phase-installation-experience-design.md",
    "aidlc-docs/phase-installation-experience-requirements.md",
    "aidlc-docs/phase-pm-l0-design.md",
    "aidlc-docs/phase-pm-l0-requirements.md",
    "aidlc-docs/phase-pm-l1-design.md",
    "aidlc-docs/phase-pm-l1-requirements.md",
    "aidlc-docs/phase-pm-l2-design.md",
    "aidlc-docs/phase-pm-l2-requirements.md",
    "aidlc-docs/phase-pm-l3-design.md",
    "aidlc-docs/phase-pm-l3-requirements.md",
    "aidlc-docs/phase-pm-l4-design.md",
    "aidlc-docs/phase-pm-l4-requirements.md",
    "aidlc-docs/phase-pm-l5-design.md",
    "aidlc-docs/phase-pm-l5-requirements.md",
    "aidlc-docs/phase-pm-7-design.md",
    "aidlc-docs/phase-pm-7-requirements.md",
    "benchmarks/product-maturity/pm-l2-retrieval-fixtures-v1.json",
    "enterprise-closure-registry.json",
    "enterprise-closure-registry.schema.json",
    "release-manifest.json",
    "release-manifest.schema.json",
    "package-manifest.json",
    "package-manifest.schema.json",
    "platform-release-contract.json",
    "release-build-lock.json",
    "release-channel-v1.json",
    "scripts/__init__.py",
    "scripts/enterprise-readiness.py",
    "scripts/package-release-proof.py",
    "scripts/platform-qualification.py",
    "scripts/supply-chain.py",
    "scripts/installer.py",
    "scripts/installation-qualification.py",
    "scripts/release-info.py",
    "scripts/release-publication.py",
    "scripts/code_relationships.py",
    "scripts/navigator-scope.py",
    "scripts/navigator_scope.py",
    "scripts/module_resolution.py",
    "scripts/navigator_graph_lifecycle.py",
    "scripts/run-tests.py",
    "scripts/session-control.py",
    "scripts/session_control.py",
    "scripts/upgrade-tailtrail.py",
    "scripts/release_manifest.py",
    "scripts/repository-enforcement.py",
    "scripts/mcp-server.py",
    "scripts/requirement_evidence.py",
    "scripts/requirement_intake.py",
    "scripts/host-adapter-conformance.py",
    "scripts/host-runtime-conformance.py",
    "scripts/learning-v3.py",
    "scripts/learning-retrieval.py",
    "scripts/learning-use-receipt.py",
    "scripts/learning-governance.py",
    "scripts/learning-calibration.py",
    "scripts/navigator-scope-calibration.py",
    "scripts/navigator-installed-release-proof.py",
    "scripts/navigator-scope-release.py",
    "tests/test_module_resolution.py",
    "tests/test_navigator_scope.py",
    "tests/test_navigator_scope_calibration.py",
    "tests/test_navigator_installed_release.py",
    "tests/test_navigator_scope_release.py",
    "scripts/adoption-validation.py",
    "schemas/repository-enforcement-policy.schema.json",
    "schemas/navigator-host-scope-proposal.schema.json",
    "schemas/navigator-scope-evidence.schema.json",
    "schemas/navigator-scope-quality.schema.json",
    "schemas/host-scope-conformance.schema.json",
    "schemas/host-requirement-routing-conformance.schema.json",
    "schemas/host-scope-reasoning-conformance.schema.json",
    "schemas/navigator-scope-calibration-catalog.schema.json",
    "schemas/navigator-scope-calibration-report.schema.json",
    "schemas/navigator-scope-release-policy.schema.json",
    "schemas/navigator-scope-migration-report.schema.json",
    "schemas/navigator-scope-release-proof.schema.json",
    "schemas/navigator-installed-release-proof.schema.json",
    "schemas/navigator-graph-lifecycle.schema.json",
    "schemas/navigator-run-mapping-index.schema.json",
    "schemas/canonical-requirement-set.schema.json",
    "schemas/requirement-interpretation.schema.json",
    "schemas/requirement-evidence-assistance.schema.json",
    "schemas/requirement-intake.schema.json",
    "schemas/requirement-sufficiency.schema.json",
    "adapters/navigator-scope-scenarios-v2.json",
    "adapters/navigator-host-reasoning-scenarios-v1.json",
    "adapters/requirement-routing-scenarios-v1.json",
    "schemas/product-maturity-learning-inventory.schema.json",
    "schemas/learning-v3-record.schema.json",
    "schemas/learning-use-proposal.schema.json",
    "schemas/learning-use-receipt-event.schema.json",
    "schemas/learning-governance-event.schema.json",
    "schemas/learning-calibration-catalog.schema.json",
    "schemas/learning-calibration-report.schema.json",
    "schemas/learning-calibration-projection.schema.json",
    "schemas/adoption-validation-catalog.schema.json",
    "schemas/adoption-validation-trial.schema.json",
    "schemas/adoption-validation-report.schema.json",
    "schemas/adoption-improvement-decision.schema.json",
    "schemas/tailtrail-session-attachment.schema.json",
    "benchmarks/evaluation/learning-calibration/v1.json",
    "benchmarks/evaluation/navigator-scope/v1.json",
    "benchmarks/evaluation/navigator-scope/release-v1.json",
    "benchmarks/evaluation/navigator-scope/fsr6-v1.json",
    "benchmarks/evaluation/navigator-scope/language-profiles-v1.json",
    "benchmarks/evaluation/navigator-scope/installed-release-v1.json",
    "benchmarks/evaluation/adoption/v1.json",
    "schemas/repository-enforcement-report.schema.json",
    "schemas/repository-enforcement-suppression.schema.json",
    "tailtrail-enforcement-baseline.json",
    "tailtrail-enforcement-policy.json",
    "tailtrail-enforcement-suppressions.json",
    "tailtrail-meta/product-maturity-learning-inventory-v1.json",
    "schemas/install-journal-event.schema.json",
    "schemas/install-ownership-manifest.schema.json",
    "schemas/install-plan.schema.json",
    "schemas/host-adapter-contract.schema.json",
    "schemas/platform-qualification-receipt.schema.json",
    "schemas/release-evidence.schema.json",
    "schemas/release-channel.schema.json",
    "schemas/release-publication-receipt.schema.json",
    "setup.py",
    "tailtrail/__init__.py",
    "tailtrail/api.py",
    "tailtrail/cli.py",
    "tailtrail/errors.py",
    "tailtrail/kernel.py",
    "tailtrail/install/__init__.py",
    "tailtrail/install/catalog.py",
    "tailtrail/install/cli.py",
    "tailtrail/install/engine.py",
    "tailtrail/install/host_launcher.py",
    "tailtrail/install/models.py",
    "tailtrail/upgrade.py",
    "tailtrail/__main__.py",
    "tailtrail/hosts/__init__.py",
    "tailtrail/hosts/contracts.py",
    "tailtrail/hosts/diagnostics.py",
    "tailtrail/migrations/__init__.py",
    "tailtrail/resources.py",
    "tests/test_enterprise_readiness.py",
    "tests/test_release_truth.py",
    "tests/test_self_contained_package.py",
    "tests/test_session_control.py",
    "tests/test_tailtrail_stop_resume.py",
    "tests/test_transactional_installer.py"
    ,"tests/test_installation_experience.py"
    ,"tests/test_enterprise_host_adapters.py",
    "tests/test_cross_platform_supply_chain.py",
    "tests/test_repository_enforcement.py",
    "tests/test_parallel_test_runner.py",
    "tests/test_learning_v3.py",
    "tests/test_learning_retrieval.py",
    "tests/test_learning_use_receipt.py",
    "tests/test_learning_governance.py",
    "tests/test_learning_calibration.py",
    "tests/test_adoption_validation.py",
    ".github/actions/enforce/action.yml",
    ".github/workflows/platform-supply-chain.yml",
    ".github/workflows/repository-enforcement.yml"
  ],
  "candidate_exclusions": {
    "files": [
      "issue.txt"
    ],
    "prefixes": [
      "aidlc-rules/"
    ]
  },
  "required_release_files": [
    ".codex-plugin/plugin.json",
    ".github/ISSUE_TEMPLATE/bug_report.md",
    ".github/ISSUE_TEMPLATE/docs_feedback.md",
    ".github/ISSUE_TEMPLATE/feature_request.md",
    ".github/ISSUE_TEMPLATE/security_note.md",
    ".github/pull_request_template.md",
    "ARCHITECTURE.md",
    "CHANGELOG.md",
    "CODE_OF_CONDUCT.md",
    "COMPLETE-END-TO-END-WORKFLOW.md",
    "CONTRIBUTING.md",
    "DEMO.md",
    "ENTERPRISE-READINESS-ASSESSMENT.md",
    "LICENSE",
    "NOTICE.md",
    "PACKAGE-CONTRACT.md",
    "INSTALLER-LIFECYCLE.md",
    "HOST-ADAPTERS.md",
    "SUPPLY-CHAIN.md",
    "REPOSITORY-ENFORCEMENT.md",
    "TAILTRAIL-STOP-RESUME-CONTROL-IMPLEMENTATION-PLAN.md",
    "PUBLIC-CLAIMS.md",
    "PUBLIC-RELEASE-METADATA.md",
    "PUBLIC-ROADMAP.md",
    "README.md",
    "RELEASE-CHECKLIST.md",
    "SECURITY.md",
    "SUPPORT.md",
    "USER-GUIDE.md",
    "VERSIONING.md",
    "enterprise-closure-registry.json",
    "enterprise-closure-registry.schema.json",
    "release-manifest.json",
    "release-manifest.schema.json",
    "package-manifest.json",
    "package-manifest.schema.json",
    "platform-release-contract.json",
    "release-build-lock.json",
    "release-channel-v1.json",
    "pyproject.toml",
    "setup.py",
    "tailtrail/__init__.py",
    "tailtrail/cli.py",
    "tailtrail/install/engine.py",
    "tailtrail/install/host_launcher.py",
    "tailtrail/upgrade.py",
    "tailtrail/__main__.py",
    "scripts/check-tailtrail.py",